20:28:40.673258 1.2.3.4.1031 > 195.117.45.130.8074: P 487845:487857(12) ack 662586188 win 8440 (DF) (ttl 127, id 47874)
	45 00 00 34 bb 02 40 00 7f 06 4b 60 01 02 03 04  E..4».@...K`....
	c3 75 2d 82 04 07 1f 8a 00 07 71 a5 27 7e 43 4c  Ãu-.......q¥'~CL
	50 18 20 f8 92 5f 00 00 02 00 00 00 04 00 00 00  P. ø._..........
	01 00 00 00                                      ....
20:28:40.703258 195.117.45.130.8074 > 1.2.3.4.1031: F 1:1(0) ack 12 win 16486 (DF) (ttl 118, id 23399)
20:28:40.833258 1.2.3.4.1031 > 195.117.45.130.8074: F 12:12(0) ack 2 win 8440 (DF) (ttl 127, id 48130)
20:28:40.873258 195.117.45.130.8074 > 1.2.3.4.1031: . ack 13 win 16486 (DF) (ttl 118, id 23499)
