20:20:37.993258 1.2.3.4.1030 > 195.117.45.131.http: S 487216:487216(0) win 8192 <mss 536,nop,nop,sackOK> (DF) (ttl 127, id 1793)
20:20:38.033258 195.117.45.131.http > 1.2.3.4.1030: S 2821328989:2821328989(0) ack 487217 win 16616 <mss 1460,nop,nop,sackOK> (DF) (ttl 118, id 5863)
20:20:38.243258 1.2.3.4.1030 > 195.117.45.131.http: . ack 1 win 8576 (DF) (ttl 127, id 2049)
20:20:38.273258 1.2.3.4.1030 > 195.117.45.131.http: P 1:157(156) ack 1 win 8576 (DF) (ttl 127, id 2305)
	45 00 00 c4 09 01 40 00 7f 06 fc d0 01 02 03 04  E..Ä..@...üÐ....
	c3 75 2d 83 04 06 00 50 00 07 6f 31 a8 2a 10 5e  Ãu-....P..o1¨*.^
	50 18 21 80 1f a6 00 00 47 45 54 20 2f 61 70 70  P.!..¦..GET /app
	73 76 63 2f 61 70 ...                            svc/ap
20:20:38.323258 195.117.45.131.http > 1.2.3.4.1030: P 1:76(75) ack 157 win 16460 (DF) (ttl 118, id 5976)
	45 00 00 73 17 58 40 00 76 06 f7 ca c3 75 2d 83  E..s.X@.v.÷ÊÃu-.
	01 02 03 04 00 50 04 06 a8 2a 10 5e 00 07 6f cd  .....P..¨*.^..oÍ
	50 18 40 4c 67 d8 00 00 48 54 54 50 2f 31 2e 30  P.@LgØ..HTTP/1.0
	20 32 30 30 20 4f ...                             200 O
20:20:38.323258 195.117.45.131.http > 1.2.3.4.1030: F 76:76(0) ack 157 win 16460 (DF) (ttl 118, id 5977)
20:20:38.503258 1.2.3.4.1030 > 195.117.45.131.http: . ack 77 win 8501 (DF) (ttl 127, id 3073)
20:20:38.513258 1.2.3.4.1030 > 195.117.45.131.http: F 157:157(0) ack 77 win 8501 (DF) (ttl 127, id 3329)
20:20:38.523258 1.2.3.4.1031 > 195.117.45.130.8074: S 487726:487726(0) win 8192 <mss 536,nop,nop,sackOK> (DF) (ttl 127, id 3585)
20:20:38.543258 195.117.45.131.http > 1.2.3.4.1030: . ack 158 win 16460 (DF) (ttl 118, id 6058)
20:20:38.573258 195.117.45.130.8074 > 1.2.3.4.1031: S 662586051:662586051(0) ack 487727 win 16616 <mss 1460,nop,nop,sackOK> (DF) (ttl 118, id 45316)
20:20:38.723258 1.2.3.4.1031 > 195.117.45.130.8074: . ack 1 win 8576 (DF) (ttl 127, id 4097)
20:20:38.763258 195.117.45.130.8074 > 1.2.3.4.1031: P 1:13(12) ack 1 win 16616 (DF) (ttl 118, id 45479)
	45 00 00 34 b1 a7 40 00 76 06 5d bb c3 75 2d 82  E..4±§@.v.]»Ãu-.
	01 02 03 04 1f 8a 04 07 27 7e 42 c4 00 07 71 2f  ........'~BÄ..q/
	50 18 40 e8 77 06 00 00 01 00 00 00 04 00 00 00  P.@èw...........
	fe 66 00 00                                      þf..
20:20:38.903258 1.2.3.4.1031 > 195.117.45.130.8074: P 1:31(30) ack 13 win 8564 (DF) (ttl 127, id 4609)
	45 00 00 46 12 01 40 00 7f 06 f4 4f 01 02 03 04  E..F..@...ôO....
	c3 75 2d 82 04 07 1f 8a 00 07 71 2f 27 7e 42 d0  Ãu-.......q/'~BÐ
	50 18 21 74 4a 14 00 00 0c 00 00 00 16 00 00 00  P.!tJ...........
	25 2b 08 00 c0 39 ...                            %+..À9
20:20:38.963258 195.117.45.130.8074 > 1.2.3.4.1031: P 13:21(8) ack 31 win 16586 (DF) (ttl 118, id 45619)
	45 00 00 30 b2 33 40 00 76 06 5d 33 c3 75 2d 82  E..0²3@.v.]3Ãu-.
	01 02 03 04 1f 8a 04 07 27 7e 42 d0 00 07 71 4d  ........'~BÐ..qM
	50 18 40 ca 77 65 00 00 03 00 00 00 00 00 00 00  P.@Êwe..........
20:20:39.123258 1.2.3.4.1031 > 195.117.45.130.8074: P 31:59(28) ack 21 win 8556 (DF) (ttl 127, id 5121)
	45 00 00 44 14 01 40 00 7f 06 f2 51 01 02 03 04  E..D..@...òQ....
	c3 75 2d 82 04 07 1f 8a 00 07 71 4d 27 7e 42 d8  Ãu-.......qM'~BØ
	50 18 21 6c cd 25 00 00 10 00 00 00 14 00 00 00  P.!lÍ%..........
	f7 1a 07 00 03 5f ...                            ÷...._
20:20:39.173258 195.117.45.130.8074 > 1.2.3.4.1031: P 21:49(28) ack 59 win 16558 (DF) (ttl 118, id 45790)
	45 00 00 44 b2 de 40 00 76 06 5c 74 c3 75 2d 82  E..D²Þ@.v.\tÃu-.
	01 02 03 04 1f 8a 04 07 27 7e 42 d8 00 07 71 69  ........'~BØ..qi
	50 18 40 ae 69 82 00 00 0c 00 00 00 14 00 00 00  P.@®i...........
	d3 c0 00 00 02 00                                ÓÀ....
20:20:39.513258 1.2.3.4.1031 > 195.117.45.130.8074: . ack 49 win 8528 (DF) (ttl 127, id 5889)
